productID,productName,productDes,image,price,sold_units,rating,no_review,link,shipmentOrigin,delivery_fee,brand,CatID,PlatID
,Cenrr PA เครื่อง ดูด ฝุ่น ใน รถ เครื่อง ดูด ฝุ่น ไร้ สาย แบบ พกพา ที่ มี ประสิทธิภาพ เครื่อง ทำ ความ สะอาด ดูด แรง สูง,การแนะนำการแนะนำการแนะนำ ชื่อผลิตภัณฑ์ เครื่องดูดฝุ่นยานพาหนะมัลติฟังก์ชัน การทำงานของผลิตภัณฑ์ ส่วนใหญ่ทำความสะอาดรถยนต์ดูดฝุ่นเป่าและอื่นๆ ชื่อผลิตภัณฑ์ เครื่องดูดฝุ่นยานพาหนะมัลติฟังก์ชัน การทำงานของผลิตภัณฑ์ ส่วนใหญ่ทำความสะอาดรถยนต์ดูดฝุ่นเป่าและอื่นๆ รายการแพ็คเกจ รายการแพ็คเกจ X ทำความสะอาดสูญญากาศX ทำความสะอาดสูญญากาศอุปกรณ์เสริม x อุปกรณ์เสริม x สายชาร์จ USB-C x สายชาร์จ USB-C x คู่มือการใช้งาน x คู่มือการใช้งาน x น้ำหนัก ก. สำหรับสูงสุด ก. สำหรับ HEPA สูงสุด ก. สำหรับ HEPA น้ำหนัก ก. สำหรับสูงสุด ก. สำหรับ HEPA สูงสุด ก. สำหรับ HEPAแนะนำเวอร์ชันแนะนำเวอร์ชันแนะนำเวอร์ชัน วัสดุของผลิตภัณฑ์ ABS วัสดุของผลิตภัณฑ์ ABS มอเตอร์ มอเตอร์ไร้แปรงถ่านอัพเกรดใหม่ มอเตอร์ มอเตอร์ไร้แปรงถ่านอัพเกรดใหม่ มอเตอร์ มอเตอร์ไร้แปรงถ่านอัพเกรดใหม่ สี เงินหรูหรา สีดำเข้ม สี เงินหรูหรา สีดำเข้ม สี เงินหรูหรา สีดำเข้ม สูญญากาศองศา PA สูญญากาศองศา PA สูญญากาศองศา PA ความจุของแบตเตอรี่ลิเธียม * มิลลิแอมป์ชั่วโมง ความจุของแบตเตอรี่ลิเธียม * มิลลิแอมป์ชั่วโมง ความจุของแบตเตอรี่ลิเธียม * มิลลิแอมป์ชั่วโมง ความจุของแบตเตอรี่ลิเธียม * มิลลิแอมป์ชั่วโมง ความจุของแบตเตอรี่ลิเธียม * มิลลิแอมป์ชั่วโมง ความเร็ว รอบต่อนาที ความเร็ว รอบต่อนาที โหมดการชาร์จ สายชาร์จ Type-C โหมดการชาร์จ สายชาร์จ Type-C เสียงรบกวน dB เสียงรบกวน dB อุณหภูมิในการทำงาน - + อุณหภูมิในการทำงาน - + ,https://ae01.alicdn.com/kf/Se9ca08c85130497eaf719018c340d04bt/Cenrr-360000PA.jpg_.webp,759.85,26,5.0,4,https://th.aliexpress.com/item/1005007233001631.html?algo_pvid=60b52947-f994-44d9-95d9-511d578723bc&algo_exp_id=60b52947-f994-44d9-95d9-511d578723bc-0&pdp_npi=4%40dis%21THB%21817.62%21759.85%21%21%21157.78%21146.63%21%402101c5a717198270408834454eb710%2112000039897388119%21sea%21TH%210%21AB&curPageLogUid=MxpGlhWalAYJ&utparam-url=scene%3Asearch%7Cquery_from%3A,Oversea,0.0,CENRR,,
,Cenrr PA เครื่อง ดูด ฝุ่น ใน รถ ยนต์ ดูด แรง สูง ไร้ สาย เครื่อง ทำ ความ สะอาด เครื่อง ดูด ฝุ่น แบบ มือ จับ แบบ พกพา,การแนะนำการแนะนำการแนะนำ ชื่อผลิตภัณฑ์ เครื่องดูดฝุ่นยานพาหนะมัลติฟังก์ชัน การทำงานของผลิตภัณฑ์ ส่วนใหญ่ทำความสะอาดรถยนต์ดูดฝุ่นเป่าและอื่นๆ ชื่อผลิตภัณฑ์ เครื่องดูดฝุ่นยานพาหนะมัลติฟังก์ชัน การทำงานของผลิตภัณฑ์ ส่วนใหญ่ทำความสะอาดรถยนต์ดูดฝุ่นเป่าและอื่นๆ รายการแพ็คเกจ รายการแพ็คเกจ X ทำความสะอาดสูญญากาศX ทำความสะอาดสูญญากาศอุปกรณ์เสริม x อุปกรณ์เสริม x สายชาร์จ USB-C x สายชาร์จ USB-C x คู่มือการใช้งาน x คู่มือการใช้งาน x น้ำหนัก ก. สำหรับสูงสุด ก. สำหรับ HEPA สูงสุด ก. สำหรับ HEPA น้ำหนัก ก. สำหรับสูงสุด ก. สำหรับ HEPA สูงสุด ก. สำหรับ HEPAแนะนำเวอร์ชันแนะนำเวอร์ชันแนะนำเวอร์ชัน วัสดุของผลิตภัณฑ์ ABS วัสดุของผลิตภัณฑ์ ABS มอเตอร์ มอเตอร์ไร้แปรงถ่านอัพเกรดใหม่ มอเตอร์ มอเตอร์ไร้แปรงถ่านอัพเกรดใหม่ มอเตอร์ มอเตอร์ไร้แปรงถ่านอัพเกรดใหม่ สี เงินหรูหรา สีดำเข้ม สี เงินหรูหรา สีดำเข้ม สี เงินหรูหรา สีดำเข้ม สูญญากาศองศา PA สูญญากาศองศา PA สูญญากาศองศา PA ความจุของแบตเตอรี่ลิเธียม * มิลลิแอมป์ชั่วโมง ความจุของแบตเตอรี่ลิเธียม * มิลลิแอมป์ชั่วโมง ความจุของแบตเตอรี่ลิเธียม * มิลลิแอมป์ชั่วโมง ความจุของแบตเตอรี่ลิเธียม * มิลลิแอมป์ชั่วโมง ความจุของแบตเตอรี่ลิเธียม * มิลลิแอมป์ชั่วโมง ความเร็ว รอบต่อนาที ความเร็ว รอบต่อนาที โหมดการชาร์จ สายชาร์จ Type-C โหมดการชาร์จ สายชาร์จ Type-C เสียงรบกวน dB เสียงรบกวน dB อุณหภูมิในการทำงาน - + อุณหภูมิในการทำงาน - + ,https://ae01.alicdn.com/kf/S61b85922d1eb4b3e8ba9385a92718db5V/Cenrr-360000PA.jpg_80x80.jpg_.webp,758.45,16,5.0,3,https://th.aliexpress.com/item/1005007233099374.html?algo_pvid=60b52947-f994-44d9-95d9-511d578723bc&algo_exp_id=60b52947-f994-44d9-95d9-511d578723bc-1&pdp_npi=4%40dis%21THB%21816.22%21758.45%21%21%21157.51%21146.36%21%402101c5a717198270408834454eb710%2112000039896777833%21sea%21TH%210%21AB&curPageLogUid=yALIDg4llXNH&utparam-url=scene%3Asearch%7Cquery_from%3A,Oversea,0.0,CENRR,,
,เครื่อง ดูด ฝุ่น ใน รถ ยนต์ Xiaomi PA in ไร้ สาย แบบ พกพา เครื่อง ดูด ฝุ่น แบบ พกพา เครื่อง ใช้ ไฟฟ้า สำหรับ รถ ยนต์ บ้าน,,https://ae01.alicdn.com/kf/S7fbd76ea4ed641c1a1b3dd9a1e84b65da/Xiaomi-9800000PA-5in1.jpg_80x80.jpg_.webp,428.12,1000,4.6,321,https://th.aliexpress.com/item/1005006952022536.html?algo_pvid=60b52947-f994-44d9-95d9-511d578723bc&algo_exp_id=60b52947-f994-44d9-95d9-511d578723bc-2&pdp_npi=4%40dis%21THB%21447.03%21428.12%21%21%2111.82%2111.32%21%402101c5a717198270408834454eb710%2112000038836721137%21sea%21TH%210%21AB&curPageLogUid=bbLpljHURaCl&utparam-url=scene%3Asearch%7Cquery_from%3A,Oversea,0.0,MIJIA,,
,เครื่อง ดูด ฝุ่น แบบ มือ จับ ไร้ สาย VC abir Pa หน้า จอ สัมผัส เซ็นเซอร์ กัน ฝุ่น อัจฉริยะ การ ควบคุม ความ เร็ว อัตโนมัติ สำหรับ ทำ ความ สะอาด พรม ปู ห้อง นอน ใน บ้าน,รหัสโปรโมชั่น NEW เมื่อสั่งซื้อ VC คุณสามารถพิมพ์รหัสนี้เพื่อรับส่วนลดมากมาย จำนวนจำกัดอย่าพลาดล่ะ เครื่องดูดฝุ่นไร้สายอัจฉริยะแบบมือถือ VC สูญญากาศ PA เซ็นเซอร์ฝุ่นอัจฉริยะหน้าจอแสดงผล LED การควบคุมความเร็วอัตโนมัติพร้อมแปรงกำจัดไรฝุ่นบนเตียงคุณสมบัติหลัก .ตรวจจับฝุ่นอินฟาเรดตรวจจับและวัดอนุภาคขนาดเล็กเพิ่มความเร็วมอเตอร์ได้อย่างชาญฉลาด .ชิปโปรเซสเซอร์ในตัวปรับความเร็วของมอเตอร์อย่างอัจฉริยะตามความเข้มของฝุ่นประสิทธิภาพในการใช้พลังงานที่เหมาะสมและยืดอายุการใช้งาน . PA สามารถดึงอนุภาคขนาดเล็กที่มองไม่เห็นออกมาซ่อนอยู่ในช่องว่างที่ทรงพลังกว่ายี่ห้ออื่นๆ .หน้าจอสัมผัสอัจฉริยะขนาดใหญ่พิเศษสลับโหมดสูญญากาศที่ปลายนิ้วดูความเร็วสุญญากาศระดับแบตเตอรี่การทำความสะอาดได้แน่นอนไม่มีการคาดเดา .จอแสดงผล LED แหวนไฟเปลี่ยนจากสีแดงเป็นสีน้ำเงินในขณะที่ทำความสะอาดฝุ่นเห็นภาพกระบวนการทำความสะอาด .แสดงพลังงานแบตเตอรี่แบบดิจิทัลรู้เวลาที่เหมาะสมในการชาร์จใหม่และจัดการเวลาในการชาร์จของคุณ .เทคโนโลยี cyclonic ที่ทันสมัยที่สุดการกรองแบบหลายขั้นตอนแยกขนทันทีฝุ่นจากการไหลเวียนของอากาศการเพิ่มพลังงานแบบหลายขั้นตอนบีบอัดฝุ่น เส้นผมให้เป็นลูกบอลทันที .HEPA เกรด E กำจัดอนุภาคฝุ่นขนาดเล็ก . สามารถล้างและนำกลับมาใช้ใหม่ได้ .มือจับ . กก. ผู้ใช้สามารถถอดท่อลมและใช้ในโหมดพกพาเพื่อทำความสะอาดเบาะรถยนต์โซฟา .แปรงพื้นไฟ LED ดวงตาที่เป็นมิตร ดูการระบายน้ำในที่มืด . กับแปรงกำจัดไรฝุ่นบนเตียงหัวฉีดรอยแยกแปรงขนอ่อนแบบ in และแปรงขัดพื้นแบบ LED รวมถึงหัวแปรง ชนิดที่ตอบสนองทุกความต้องการของคุณ . ถ้วยฝุ่นที่ . L ไม่จำเป็นต้องว่างเปล่าบ่อยและทำความสะอาด . HEPA ทั้งหมดลูกกลิ้งนุ่มถ้วยกันฝุ่นพายุไซโคลนสามารถถอดออกและล้างทำความสะอาดได้ค่าใช้จ่ายในการบำรุงรักษาน้อยที่สุดข้อมูลจำเพาะน้ำหนักที่จับ . กก.ความจุถ้วยเก็บฝุ่น . Lความจุของแบตเตอรี่ Li-ion mAhพลังดูด สูงสุด PAเวลาในการทำงาน นาที โหมด ECO - นาที โหมดมาตรฐาน นาที โหมดสูงสุด เวลาชาร์จ ชั่วโมงระดับเสียง - dBแรงดันไฟฟ้า - V AC Hzขนาดบรรจุภัณฑ์ x x มม.หมายเหตุ .โปรดระบุชื่อเต็มของคุณเมื่อกรอกที่อยู่ .หุ่นยนต์ของเราเหมาะสำหรับทุกประเทศ อะแดปเตอร์เป็นแบบ EU มีขา ขารูปทรงกลมมีแรงดันไฟฟ้าขาเข้า - V และความถี่ Hzหากคุณเป็นผู้ซื้อจากออสเตรเลียนิวซีแลนด์ฯลฯประเทศที่ใช้ปลั๊กแบบออสเตรเลียเราจะใส่ปลั๊กออสเตรเลียลงในพัสดุหากคุณเป็นผู้ซื้อจากสหรัฐอเมริกาแคนาดาฯลฯประเทศที่ใช้ปลั๊กแบบอเมริกันเราจะให้เราเสียบปลั๊กในพัสดุหากคุณเป็นผู้ซื้อจากประเทศในสหราชอาณาจักรมาเลเซียฯลฯซึ่งใช้ปลั๊กแบบอังกฤษเราจะใส่ปลั๊กแบบอังกฤษลงในพัสดุ,https://ae01.alicdn.com/kf/Sab080236e2c24c77a2a16de8578badcbC/VC205-abir-27000Pa.jpg_80x80.jpg_.webp,5908.0,228,4.6,24,https://th.aliexpress.com/item/1005006527690815.html?algo_pvid=60b52947-f994-44d9-95d9-511d578723bc&aem_p4p_detail=202407010244001840338206371840005066678&algo_exp_id=60b52947-f994-44d9-95d9-511d578723bc-3&pdp_npi=4%40dis%21THB%2118153.41%215908.94%21%21%21480.00%21156.24%21%402101c5a717198270408834454eb710%2112000037816610308%21sea%21TH%210%21AB&curPageLogUid=LppSKBf3pWYu&utparam-url=scene%3Asearch%7Cquery_from%3A&search_p4p_id=202407010244001840338206371840005066678_1,Oversea,0.0,ABIR,,
,เครื่อง ทำ ความ สะอาด พรม สัตว์ เลี้ยง แบบ พกพา เครื่อง ดูด ฝุ่น ทรง พลัง สำหรับ พรมพรม ที่ นอน เบาะ รถ ยนต์ เฟอร์นิเจอร์ เครื่อง ทำ ความ สะอาด จุด ลึก,,https://ae01.alicdn.com/kf/S4c7438f8341c4affaadd5a783198d55fl/-.jpg_80x80.jpg_.webp,4076.0,0,0.0,0,https://th.aliexpress.com/item/1005007253100068.html?algo_pvid=60b52947-f994-44d9-95d9-511d578723bc&algo_exp_id=60b52947-f994-44d9-95d9-511d578723bc-4&pdp_npi=4%40dis%21THB%218153.15%214076.58%21%21%21215.58%21107.79%21%402101c5a717198270408834454eb710%2112000039955328538%21sea%21TH%210%21AB&curPageLogUid=v4izXNVh8W3a&utparam-url=scene%3Asearch%7Cquery_from%3A,Oversea,0.0,No brand,,
,เครื่อง ดูด ฝุ่น ใน รถ ยนต์ Xiaomi PA ไร้ สาย แบบ เปียก แห้ง เครื่อง ทำ ความ สะอาด เครื่อง ใช้ ไฟฟ้า มือถือ แบบ พกพา ใช้ ได้ สอง ทาง สำหรับ รถ บ้าน,เครื่องดูดฝุ่นในรถยนต์ Xiaomi PA ไร้สายแบบเปียกแห้งเครื่องทำความสะอาดเครื่องใช้ไฟฟ้ามือถือแบบพกพาใช้ได้สองทางสำหรับรถบ้านอธิบาย เทคโนโลยีที่อัปเกรดเพื่อพลังในการทำความสะอาดขั้นสูงสุด เครื่องดูดฝุ่นแบบมือจับไร้สายที่อัปเกรดมาพร้อมกับโหมดการดูดไซโคลนอันทรงพลังถึง kPa เพื่อให้ตรงกับวัตถุประสงค์ในการทำความสะอาดที่แตกต่างกันของคุณ พวกเขาเป็นอุปกรณ์อเนกประสงค์ที่สามารถทำความสะอาดอะไรก็ได้ตั้งแต่ใยแมงมุมไปจนถึงตู้ไปจนถึงเบาะรถยนต์ คำเตือนที่อบอุ่น หากวัตถุที่เปียกและน้ำถูกดูดซับโดยไม่ได้ตั้งใจพวกเขาจะต้องเช็ดให้แห้งทันทีเพื่อหลีกเลี่ยงความเสียหายของเครื่องยนต์ ดีไซน์ไร้สายน้ำหนักเบา เครื่องดูดฝุ่นขนาดเล็กนี้มีน้ำหนักเพียง . ปอนด์และมาพร้อมกับถังขยะขนาด ออนซ์ที่มีขนาดใหญ่พอ สามารถถ่ายได้เกือบทุกที่ที่คุณต้องการและยังใช้งานได้ตามที่คุณต้องการ กำจัดสายไฟที่พันกันและแก้ปัญหาที่เข้าถึงได้ยาก ขนาดเล็กของพวกเขาช่วยให้พวกเขาสามารถหาสถานที่ของพวกเขาในตู้ โรงรถ ห้องซักรีดหรือมุมอื่นๆที่เหมาะสม แบตเตอรี่ใช้งานได้ยาวนานและชาร์จเร็ว ด้วยการใช้แบตเตอรี่ลิเธียมแบตเตอรี่ Ion mAh และเทคโนโลยีการชาร์จที่รวดเร็วสามารถยืดอายุแบตเตอรี่ได้ประมาณ นาทีหลังจากชาร์จเต็ม เทคโนโลยีการชาร์จที่รวดเร็วของเรารวมถึงการป้องกันไฟกระชากลิเธียมแบตเตอรี่โทรศัพท์เพื่อให้มั่นใจในการทำงานที่ปลอดภัย ไฟ LED บนเครื่องดูดฝุ่นในรถไร้สายเหมาะอย่างยิ่งสำหรับให้แสงสว่างในที่มืดและมองเห็นยาก อุปกรณ์เสริมระดับมืออาชีพแก้ปัญหาการทำความสะอาดได้มากขึ้น แปรงปัดฝุ่นและเครื่องมือรอยแยกสามารถเข้าถึงผู้ถือถ้วยและช่องเก็บของในรถได้มากที่สุด ท่อต่อช่วยป้องกันฝุ่นออกจากฐานผ้าม่านและใยแมงมุมที่น่ารำคาญในมุมเพดาน ใช้อุปกรณ์เสริมเพิ่มเติมเพื่อให้ครอบคลุมทุกนิ้วในบ้านของคุณ เครื่องดูดฝุ่นแบบมือจับที่มีตัวกรอง HEPA แบบถอดได้ล้างทำความสะอาดได้และนำกลับมาใช้ได้คงทน หลังจากทำความสะอาดไส้กรองแล้วปล่อยให้แห้งก่อนนำกลับเข้าไปในสุญญากาศ การสนับสนุนลูกค้า เครื่องดูดฝุ่นแบบมือจับที่มีถุงยืนมีน้ำหนักเบาและพกพาได้ดังนั้นคุณสามารถพกพาไปได้ทุกที่ที่คุณต้องการทำความสะอาดแม้ในขณะเดินทาง คุณสามารถใช้มันทำความสะอาดทรายออกจากเต็นท์ของคุณ หากคุณมีคำถามหรือปัญหาเกี่ยวกับเครื่องดูดฝุ่นไร้สายโปรดติดต่อเรา ทีมลูกค้าพร้อมเสมอสำหรับการสอบถามของคุณและจะพยายามอย่างดีที่สุดเพื่อช่วยเหลือลูกค้าทุกท่าน,https://ae01.alicdn.com/kf/S1ec894ac15dd4b98a6cdca836655c033f/Xiaomi-9800000PA.jpg_.webp,454.51,69,5.0,3,https://th.aliexpress.com/item/1005007250518623.html?algo_pvid=60b52947-f994-44d9-95d9-511d578723bc&algo_exp_id=60b52947-f994-44d9-95d9-511d578723bc-5&pdp_npi=4%40dis%21THB%211136.31%21454.51%21%21%21219.28%2187.71%21%402101c5a717198270408834454eb710%2112000039958326263%21sea%21TH%210%21AB&curPageLogUid=5pivZdHj0AJZ&utparam-url=scene%3Asearch%7Cquery_from%3A,Oversea,0.0,MIJIA,,
