productID,productName,productDes,image,price,sold_units,rating,no_review,link,shipmentOrigin,delivery_fee,brand,CatID,PlatID
,เส้น ผม สำหรับ สัตว์ เลี้ยง ที่ บ้าน เครื่อง ทำ ความ สะอาด แบบ สุญญากาศ อัตโนมัติ ไร้ สาย เครื่อง ดูด ฝุ่น แบบ มือ จับ ภาย ใน รถ ถอด ออก ได้ อเนกประสงค์ แบบ พกพา ได้,ข้อมูลจำเพาะ ประเภทสิ่งของ เครื่องดูดฝุ่นการรับรอง CEแหล่งกำเนิด จีนแผ่นดินใหญ่ชื่อรุ่น เครื่องดูดฝุ่นในรถยนต์การรับรองการทดสอบภายนอก CEขนาดผลิตภัณฑ์ . x . x ซม. . x . x . inวัสดุของผลิตภัณฑ์ ABS + ชิ้นส่วนอิเล็กทรอนิกส์บรรจุภัณฑ์ของผลิตภัณฑ์ บรรจุกล่องความจุแบตเตอรี่ mAhกำลังผลิตภัณฑ์ Wแรงดันไฟฟ้าที่กำหนด . Vความเร็วที่กำหนด R นาที การดูดสูญญากาศ mBar สี ขาวดำข้อมูลจำเพาะ แหล่งกำเนิด จีนแผ่นดินใหญ่หมายเลขรุ่น ผ้าทำความสะอาดคุณสมบัติ เป็นมิตรกับสิ่งแวดล้อมการใช้งาน สุขาภิบาลการผลิต แผ่นใยขัดวัสดุ ไมโครไฟเบอร์ขนาด x ซม. . x . in x ซม. . x . in x ซม. . x . inสี สีเทาจำนวน ชิ้นฟังก์ชั่น สามารถเช็ดพื้นผิวที่เรียบหลากหลายเครื่องดูดฝุ่นพลังสูงถอดออกได้อเนกประสงค์สามารถชาร์จไฟได้สำหรับทำความสะอาดภายในรถเครื่องดูดฝุ่นแบบมือจับคุณสมบัติ .การออกแบบที่ถอดออกได้ กุญแจกล่องเก็บฝุ่นที่ถอดออกได้ถูกนำมาใช้เพื่อทิ้งฝุ่นบอกลาฝุ่นล้นที่น่าเบื่อและไม่ทำให้มือของคุณสกปรก .ออกแบบตามหลักสรีรศาสตร์ การขยายยานพาหนะหมายความว่าคุณไม่จำเป็นต้องโค้งงอบ่อยครั้ง ด้ามจับที่สะดวกสบายและสะอาดตามหลักสรีรศาสตร์ .น้ำหนักเบาและพกพาได้ ง่ายต่อการพกพาและควบคุมแม้ในพื้นที่ขนาดเล็ก รอกง่ายต่อการกดและทำความสะอาด .ขนแปรงอ่อนนุ่ม ขนแปรงนุ่มดูดซับฝุ่นและปกป้องพื้นหนัง .การใช้งานหลายพื้นผิว กำจัดขน สิ่งสกปรกและเศษซากจากพรม การตกแต่งภายในรถยนต์ เฟอร์นิเจอร์และพื้นที่การจราจรหนาแน่น ข้อมูลจำเพาะ แหล่งกำเนิด จีนแผ่นดินใหญ่ขนาด * * ซม. . * . * . นิ้ว รุ่นผลิตภัณฑ์ XC- แรงดันแบตเตอรี่ . V กำลังไฟที่ได้รับการจัดอันดับ W การดูดสินค้า PA ความจุแบตเตอรี่ mAh ขนาดกล่อง . x . x ซม. . x . x . inการติดตั้ง USB,https://ae01.alicdn.com/kf/S3c0abb3fcbb0492cb00b7364a41853d7V/-.jpg_.webp,223.29,0,0.0,0,https://th.aliexpress.com/item/1005007004586181.html?algo_pvid=f18f5171-6f12-4226-9189-dc2a0922a63c&algo_exp_id=f18f5171-6f12-4226-9189-dc2a0922a63c-14&pdp_npi=4%40dis%21THB%21429.38%21223.29%21%21%2182.86%2143.09%21%402103011417198271607696551eed49%2112000039020119272%21sea%21TH%210%21AB&curPageLogUid=nN1Hm4m5CzRG&utparam-url=scene%3Asearch%7Cquery_from%3A,Oversea,0.0,ANENG,,
,Baseus A Lite Pa เครื่อง ดูด ฝุ่น รถ ยนต์ การ ไหล ของ อากาศ ปั๊ม ไร้ สาย แบบ พกพา อุปกรณ์ ทำ ความ สะอาด รถ Mini เครื่อง ดูด ฝุ่น สำหรับ ไฟ LED,,https://ae01.alicdn.com/kf/Sc3538b1441b34ab6918d627084828101o/Baseus-A3-Lite-12000Pa.jpg_80x80.jpg_.webp,1442.0,67,5.0,9,https://th.aliexpress.com/item/1005005387419771.html?algo_pvid=f18f5171-6f12-4226-9189-dc2a0922a63c&aem_p4p_detail=2024070102460015303021654493200005109997&algo_exp_id=f18f5171-6f12-4226-9189-dc2a0922a63c-15&pdp_npi=4%40dis%21THB%211582.75%211442.82%21%21%2141.85%2138.15%21%402103011417198271607696551eed49%2112000032847473520%21sea%21TH%210%21AB&curPageLogUid=QWR1qnn4yANB&utparam-url=scene%3Asearch%7Cquery_from%3A&search_p4p_id=2024070102460015303021654493200005109997_4,Oversea,0.0,BASEUS,,
,เครื่อง ดูด ฝุ่น ไร้ สาย S W เครื่อง ถู แบบ in เครื่อง ดูด ฝุ่น ไร้ สาย kPa ประสิทธิภาพ สูง จอ แสดง ผล LED เครื่อง กวาด แบบ มือถือ,โปรดคัดลอกรหัสส่วนลดนี้- และวางรหัสนี้เมื่อคุณชำระเงิน BBB เครื่องถูพื้นแบบไฟฟ้า LED in W เครื่องดูดฝุ่นแบบมือจับ S kPa ทรงพลังแนวตั้ง ใน ,https://ae01.alicdn.com/kf/Sfa6a1e51d6bc4255b653f4137f6f51b6b/S15-450W-5-in-1.jpg_80x80.jpg_.webp,7904.0,19,4.7,10,https://th.aliexpress.com/item/1005005970647654.html?algo_pvid=f18f5171-6f12-4226-9189-dc2a0922a63c&algo_exp_id=f18f5171-6f12-4226-9189-dc2a0922a63c-16&pdp_npi=4%40dis%21THB%217923.28%217904.37%21%21%211529.00%211525.35%21%402103011417198271607696551eed49%2112000036181835451%21sea%21TH%210%21AB&curPageLogUid=c5GFGM5iW6QS&utparam-url=scene%3Asearch%7Cquery_from%3A,Oversea,0.0,JIZHOU,,
,Xinrui หุ่น ยนต์ กวาด พื้น in หุ่น ยนต์ กวาด พื้น และ ดูด ฝุ่น ไร้ สาย สำหรับ ใช้ ใน บ้าน,ซินรูอิหุ่นยนต์กวาดพื้นอัจฉริยะแบบ in สำหรับใช้ในบ้านหุ่นยนต์กวาดพื้นดูดฝุ่นและดูดฝุ่นไร้สายสำหรับใช้ในบ้านข้อดีของผลิตภัณฑ์ หมายเหตุ หากมีปัญหาใดๆกับผลิตภัณฑ์กรุณาติดต่อฉันและอย่าโต้แย้งโดยตรง ขอบคุณมากสำหรับการสนับสนุนและความเข้าใจของคุณขอบคุณอีกครั้ง หมายเหตุ หลังจากได้รับสินค้าแล้วโปรดถอดการ์ดขนาดเล็กสีขาวออกชาร์จ ชั่วโมงแล้วถอดฝาครอบล้อกลางด้านล่างออกและสามารถทำงานได้ตามปกติ ,https://ae01.alicdn.com/kf/Sf82c86c4c4574e77a3d1e2eb6bbc73d1R/Xinrui-3-in-1.jpg_80x80.jpg_.webp,276.82,0,0.0,0,https://th.aliexpress.com/item/1005007081636346.html?algo_pvid=f18f5171-6f12-4226-9189-dc2a0922a63c&algo_exp_id=f18f5171-6f12-4226-9189-dc2a0922a63c-17&pdp_npi=4%40dis%21THB%21289.83%21276.82%21%21%2155.93%2153.42%21%402103011417198271607696551eed49%2112000039353121691%21sea%21TH%210%21AB&curPageLogUid=dhthHg9p9t8w&utparam-url=scene%3Asearch%7Cquery_from%3A,Oversea,0.0,LIXIU,,
,หัวแปรง อเนกประสงค์ ใช้ งาน ได้ กับ ชิ้นส่วน อะไหล่ หัว เครื่อง กำจัด สิว เสี้ยน ไร ฝุ่น ทำ ความ สะอาด ขนาด เส้น ผ่าน ศูนย์กลาง ภาย ใน มม. และ มม.,,https://ae01.alicdn.com/kf/S713f37d81f9f49eabede24659b1bef4bO/-.jpg_.webp,448.55,9,4.0,2,https://th.aliexpress.com/item/1005005449326234.html?algo_pvid=f18f5171-6f12-4226-9189-dc2a0922a63c&aem_p4p_detail=2024070102460015303021654493200005109997&algo_exp_id=f18f5171-6f12-4226-9189-dc2a0922a63c-19&pdp_npi=4%40dis%21THB%21897.16%21448.55%21%21%21173.13%2186.56%21%402103011417198271607696551eed49%2112000033405848145%21sea%21TH%210%21AB&curPageLogUid=g0W0t1lmun7N&utparam-url=scene%3Asearch%7Cquery_from%3A&search_p4p_id=2024070102460015303021654493200005109997_5,Oversea,0.0,No brand,,
,เครื่อง ดูด ฝุ่น ไร้ สาย แบบ เปียก และ แห้ง เครื่อง ดูด ฝุ่น แบบ มือ จับ Pa เครื่อง ดูด ฝุ่น อัตโนมัติ ไร้ สาย สำหรับ ใช้ ใน บ้าน ขน สัตว์ เลี้ยง,เครื่องดูดฝุ่นไร้สายแบบเปียกและแห้งเครื่องดูดฝุ่นแบบมือจับ Pa เครื่องดูดฝุ่นอัตโนมัติไร้สายสำหรับใช้ในบ้านขนสัตว์เลี้ยงข้อมูลผลิตภัณฑ์ เวลาความอดทน -Speed - Min -Speed - min กำลังข้อต่อ เกียร์ PA เกียร์ Pa กำลังขับ wbattery กำลังผลิตภัณฑ์ W เวลาชาร์จ ประมาณ ชั่วโมง ความจุ mAh * วัสดุ กรอบ ABS ความจุฝุ่น . L เสียงรบกวนในการทำงาน dB แรงดันไฟฟ้าที่ชาร์จ DC- V แรงดันไฟฟ้าในการทำงาน . V ประเภทตลับหมึก แผ่นใยปกป้องสิ่งแวดล้อมที่ล้างทำความสะอาดได้คำแนะนำผู้ใช้ .ชาร์จเต็มก่อนใช้งานครั้งแรก .กดปุ่มเพาเวอร์เพื่อเปิดอุปกรณ์ประกาศ สีที่แท้จริงของสินค้าอาจแตกต่างจากสีที่แสดงในภาพเล็กน้อยเนื่องจากมีการแสดงผลและเอฟเฟกต์แสงที่แตกต่างกัน ขอบคุณ โปรดยอมรับความคลาดเคลื่อนในการวัด - ซม. เนื่องจากการวัดด้วยมือ,https://ae01.alicdn.com/kf/Scc4bb2e5c867469198002704927e16b1c/15000Pa.jpg_.webp,944.31,25,3.0,10,https://th.aliexpress.com/item/1005006058961864.html?algo_pvid=f18f5171-6f12-4226-9189-dc2a0922a63c&algo_exp_id=f18f5171-6f12-4226-9189-dc2a0922a63c-20&pdp_npi=4%40dis%21THB%212098.50%21944.31%21%21%21404.96%21182.23%21%402103011417198271607696551eed49%2112000035544128909%21sea%21TH%210%21AB&curPageLogUid=rpAYkp87T29I&utparam-url=scene%3Asearch%7Cquery_from%3A,Oversea,0.0,No brand,,
,เครื่อง ดูด ฝุ่น ใน รถ ยนต์ ขนาด เล็ก ไร้ สาย แบบ เครื่อง ดูด ฝุ่น แบบ มือ จับ ชาร์จ ไฟ ได้ สำหรับ รถ ยนต์ บ้าน สำนักงาน การ ทำ ความ สะอาด เส้น ขน สัตว์ เลี้ยง ใน รถ ยนต์,,https://ae01.alicdn.com/kf/S4c337641f6174f2ba98a78cd330974d1f/-.jpg_.webp,377.06,17,0.0,0,https://th.aliexpress.com/item/1005006923515557.html?algo_pvid=f18f5171-6f12-4226-9189-dc2a0922a63c&algo_exp_id=f18f5171-6f12-4226-9189-dc2a0922a63c-21&pdp_npi=4%40dis%21THB%21963.96%21377.06%21%21%21186.02%2172.76%21%402103011417198271607696551eed49%2112000038737093275%21sea%21TH%210%21AB&curPageLogUid=VQazUsR0wQ9S&utparam-url=scene%3Asearch%7Cquery_from%3A,Oversea,0.0,No brand,,
,เครื่อง ดูด ฝุ่น ไร้ สาย ขนาด เล็ก พกพา ได้ อุปกรณ์ ทำ ความ สะอาด ใน ครัวเรือน, ไร้สายและพกพาได้ ไม่จำเป็นต้องมีสายไฟหรืออุปกรณ์เสริมเครื่องดูดฝุ่นนี้เคลื่อนย้ายไปรอบๆได้ง่ายและใช้งานได้ทุกที่ แรงดูดขนาดใหญ่ ด้วยพลังดูดที่มากกว่า W เครื่องดูดฝุ่นนี้สามารถจัดการได้แม้กระทั่งงานทำความสะอาดที่ยากที่สุด แปรงอเนกประสงค์ หัวดูดพิเศษมีแปรงอเนกประสงค์ทำให้ทำความสะอาดบริเวณที่ยากต่อการเข้าถึงได้ง่าย แบตเตอรี่ Li-ion เครื่องดูดฝุ่นใช้แบตเตอรี่ Li-ion ซึ่งมีอายุการใช้งานแบตเตอรี่ที่ยาวนานกว่าและการทำความสะอาดที่มีประสิทธิภาพมากกว่าคุณสมบัติข้อมูลจำเพาะวิธีใช้แพคเกจรวมประกาศสีที่แท้จริงของสินค้าอาจแตกต่างจากสีที่แสดงในรูปเล็กน้อยเนื่องจากมีการแสดงผลและเอฟเฟกต์แสงที่แตกต่างกันขอบคุณ ,https://ae01.alicdn.com/kf/Se43936f9218a45d19fe8c20f6211c23f1/-.png_.webp,523.9,54,4.5,4,https://th.aliexpress.com/item/1005006439954100.html?algo_pvid=f18f5171-6f12-4226-9189-dc2a0922a63c&algo_exp_id=f18f5171-6f12-4226-9189-dc2a0922a63c-22&pdp_npi=4%40dis%21THB%21523.90%21179.00%21%21%21101.10%2134.54%21%402103011417198271607696551eed49%2112000037172677855%21sea%21TH%210%21AB&curPageLogUid=PKXmGzai9yFt&utparam-url=scene%3Asearch%7Cquery_from%3A,Oversea,0.0,No brand,,
,แท่น ชาร์จ ของ แท้ อะไหล่ สำหรับ หุ่น ยนต์ ถู พื้น LITE PRO ที่ ชาร์จ CDZS MJSTS หุ่น ยนต์ อะไหล่ เครื่อง ดูด ฝุ่น,เครื่องดูดฝุ่นหุ่นยนต์ Mi Lite หุ่นยนต์ดูดฝุ่น Mi Pro MJST SHW MJSTS CDZS Mjstl แท่นชาร์จ,https://ae01.alicdn.com/kf/Se62dfe90d96f421b91776dc1cc0daff2L/2-LITE-PRO.jpg_.webp,1441.0,5,4.5,2,https://th.aliexpress.com/item/1005005468355750.html?algo_pvid=f18f5171-6f12-4226-9189-dc2a0922a63c&aem_p4p_detail=2024070102460015303021654493200005109997&algo_exp_id=f18f5171-6f12-4226-9189-dc2a0922a63c-23&pdp_npi=4%40dis%21THB%211460.21%211441.30%21%21%2138.61%2138.11%21%402103011417198271607696551eed49%2112000033201057911%21sea%21TH%210%21AB&curPageLogUid=CVzE0WAhKHKH&utparam-url=scene%3Asearch%7Cquery_from%3A&search_p4p_id=2024070102460015303021654493200005109997_6,Oversea,0.0,No brand,,
,เครื่อง ดูด ฝุ่น บน เตียง ไร ฝุ่น ไร้ สาย แบบ มือถือ เครื่อง ทำ ความ สะอาด กำจัด ไรยูวี สำหรับ หมอน โซฟา แผ่น ของ เล่น ตุ๊กตา,,https://ae01.alicdn.com/kf/S0060549133db4859809934db3b573f60N/-.jpg_.webp,499.77,80,4.2,9,https://th.aliexpress.com/item/1005006876250885.html?algo_pvid=f18f5171-6f12-4226-9189-dc2a0922a63c&algo_exp_id=f18f5171-6f12-4226-9189-dc2a0922a63c-24&pdp_npi=4%40dis%21THB%211854.95%21499.77%21%21%21357.96%2196.44%21%402103011417198271607696551eed49%2112000038593080127%21sea%21TH%210%21AB&curPageLogUid=KNng1Ql4yPtp&utparam-url=scene%3Asearch%7Cquery_from%3A,Oversea,0.0,VGEBY,,
,หุ่น ยนต์ ดูด ฝุ่น ขนาด เล็ก หุ่น ยนต์ ดูด ฝุ่น และ ถู พื้น - in - ,,https://ae01.alicdn.com/kf/S1e66bf69fdd9465b9aa03a26f04ac22e0/2-in-1.jpg_80x80.jpg_.webp,405.08,0,0.0,0,https://th.aliexpress.com/item/1005007050616845.html?algo_pvid=f18f5171-6f12-4226-9189-dc2a0922a63c&algo_exp_id=f18f5171-6f12-4226-9189-dc2a0922a63c-25&pdp_npi=4%40dis%21THB%211539.36%21405.08%21%21%21297.06%2178.17%21%402103011417198271607696551eed49%2112000039427577717%21sea%21TH%210%21AB&curPageLogUid=MCHEdTCedbMM&utparam-url=scene%3Asearch%7Cquery_from%3A,Oversea,0.0,No brand,,
,S มือ ถือ เครื่อง ดูด ฝุ่น KPa W มี ประสิทธิภาพ ใน ตรง เครื่อง ดูด ฝุ่น ไร้ สาย จอ แสดง ผล LCD สมาร์ท เวลา ทำ งาน นาที พับ เก็บ ได้ ไฟ LED ตรวจ จับ ฝุ่น ถัง ซับเปียก,โปรดคัดลอกรหัสส่วนลดนี้- และวางรหัสนี้เมื่อคุณชำระเงิน SSS kPa เครื่องดูดฝุ่นแบบมือจับ S W เครื่องดูดฝุ่นแบบไร้สายในแนวตั้ง in ที่มีประสิทธิภาพจอแสดงผล LCD อัจฉริยะเครื่องถูพื้นเปียกแบบมือถือน้ำหนักเบาทำงานได้ นาทีพับได้ เครื่องตรวจจับฝุ่น LED เครื่องดูดฝุ่น KPa แรงดูดทรงพลังและมอเตอร์ดิจิตอล วัตต์ เครื่องดูดฝุ่นไร้สายมาพร้อมกับเครื่องดูดฝุ่นรุ่นล่าสุด S มอเตอร์ ซึ่งสามารถให้กำลังไฟ W ทำให้มั่นใจได้ถึงพลังดูดที่ไม่เคยมีมาก่อนจนถึง kPa ง่ายและกำจัดสิ่งสกปรกเศษซากขนสัตว์เลี้ยงได้อย่างมีประสิทธิภาพแม้บนพรมที่มีขนาดยาว หน้าจอสัมผัสอัจฉริยะ LCD เครื่องดูดฝุ่นมีแผงเซ็นเซอร์อัจฉริยะ LCD ล่าสุดแสดงอินเตอร์เฟซที่ใช้งานง่ายคุณสามารถสัมผัสเพื่อสลับโหมดการดูดตรวจสอบพลังงานของแบตเตอรี่ความสมบูรณ์ของถ้วยฝุ่นความผิดพลาดปลุกในเวลาจริงMing ทำความสะอาดพื้นที่ m ในการชาร์จครั้งเดียว ก้อนแบตเตอรี่สูญญากาศได้รับ S อัปเกรดเป็นแบตเตอรี่ขนาด * mAhแบตเตอรี่รองรับการทำความสะอาด m ด้วยโหมดพลังงานมาตรฐานรองรับการทำความสะอาด m ด้วยโหมดพลังงานกลางและรองรับการทำความสะอาด m ด้วยโหมดพลังงานสูงสุด ซึ่งช่วยให้คุณทำความสะอาดบ้าน - m ในครั้งเดียว แท่งดูดฝุ่นและแปรงพื้นรูปตัววีแบบพับได้ ไม้กายสิทธิ์ดูดฝุ่น S สามารถพับได้ ได้อย่างง่ายดายซึ่งง่ายมากในการทำความสะอาดมุมที่ตายแล้วโดยไม่โค้งงอ แปรงกลิ้งรูปตัววีที่ปรับปรุงใหม่นี้สามารถช่วยลดการพัวพันของเส้นผมได้อย่างมีประสิทธิภาพ การกรองประสิทธิภาพสูง ระดับ ตัวดูดฝุ่นขนาดใหญ่ . L เครื่องดูดฝุ่นแบบแท่งไร้สาย S ใช้ระบบพายุไซโคลนที่ดีเยี่ยมซึ่งสามารถดักจับ . ของอนุภาคฝุ่นเล็กๆได้อย่างมีประสิทธิภาพและปล่อยอากาศบริสุทธิ์สะอาด,https://ae01.alicdn.com/kf/S1fe2c63275ca4444a5033496918e1ee43/S16-35KPa-450W-6-1.jpg_80x80.jpg_.webp,5730.0,362,4.7,212,https://th.aliexpress.com/item/1005006021159959.html?algo_pvid=f18f5171-6f12-4226-9189-dc2a0922a63c&algo_exp_id=f18f5171-6f12-4226-9189-dc2a0922a63c-26&pdp_npi=4%40dis%21THB%219426.06%215730.99%21%21%211819.00%211105.94%21%402103011417198271607696551eed49%2112000035363295759%21sea%21TH%210%21AB&curPageLogUid=imIeHBbmv7GZ&utparam-url=scene%3Asearch%7Cquery_from%3A,Oversea,0.0,YRX,,
,แผ่น กรอง HEPA สำหรับ Dyson V อะไหล่ เปลี่ยน แผ่น กรอง แบบ ซัก ได้ SV อุปกรณ์ เสริม สำหรับ หุ่น ยนต์ ดูด ฝุ่น,รุ่นที่เข้ากันได้ คุณสมบัติ ตัวกรองรักษาประสิทธิภาพการทำความสะอาดของหุ่นยนต์ลดการเข้าไปของฝุ่นละอองเรณูและสารก่อภูมิแพ้อื่นๆสู่อากาศควรเปลี่ยนอุปกรณ์เสริมทุก ถึง เดือนชิ้นส่วนทั้งหมดทำจากวัสดุที่มีความแข็งแรงสูงและเป็นมิตรกับสิ่งแวดล้อมง่ายต่อการกำจัดสิ่งสกปรกฝุ่นและถังขยะที่มุมและขอบออกจากอุปกรณ์เสริมโดยเฉพาะเส้นผมมนุษย์และขนของสัตว์เลี้ยงชิ้นส่วนอุปกรณ์เสริมมีความทนทานและติดตั้งง่าย,https://ae01.alicdn.com/kf/S5ba583e032854c5f89a1a0993d8bed74L/HEPA-Dyson-V10-SV12.jpg_80x80.jpg_.webp,181.16,199,4.6,34,https://th.aliexpress.com/item/1005005209496278.html?algo_pvid=f18f5171-6f12-4226-9189-dc2a0922a63c&aem_p4p_detail=2024070102460015303021654493200005109997&algo_exp_id=f18f5171-6f12-4226-9189-dc2a0922a63c-27&pdp_npi=4%40dis%21THB%21237.89%21181.16%21%21%216.29%214.79%21%402103011417198271607696551eed49%2112000032184358364%21sea%21TH%210%21AB&curPageLogUid=mDdC9E6wShM7&utparam-url=scene%3Asearch%7Cquery_from%3A&search_p4p_id=2024070102460015303021654493200005109997_7,Oversea,0.0,No brand,,
