productID,productName,productDes,image,price,sold_units,rating,no_review,link,shipmentOrigin,delivery_fee,brand,CatID,PlatID
,LIECTROUX B เครื่อง ดูด ฝุ่น หุ่น ยนต์ ถัง น้ำ Wet Dry WithTone ตาราง virtual Blocker ชาร์จ ด้วย ตน เอง Matt Finish,ชื่อผลิตภัณฑ์ มัลติฟังก์ชั่เครื่องดูดฝุ่นหุ่นยนต์หมายเลขสินค้า B หมายเหตุ หมายเหตุ .ถ้าส่งจากต่างประเทศโกดังมีโลโก้ LIECTROUX พิมพ์บนหุ่นยนต์ ถ้าส่งจากประเทศจีนโกดังไม่มีโลโก้ LIECTROUX พิมพ์บนหุ่นยนต์ แต่ระหว่าง Busy Season และพิเศษเวลา เราสต็อกบางหุ่นยนต์ไม่มี LIECTROUX โลโก้ต่างประเทศคลังสินค้า SO We Can ตรวจสอบให้แน่ใจว่าหุ่นยนต์จัดส่งให้คุณกับ LIECTROUX โลโก้ What We Can Make Sure เป็นหุ่นยนต์ขายนี้ Store และจัดส่งคุณทำจาก LIECTROUX บริษัท กรุณายืนยันได้ยอมรับนี้ก่อนซื้อ. .ถ้าส่งจากต่างประเทศโกดังมีโลโก้ LIECTROUX พิมพ์บนหุ่นยนต์ ถ้าส่งจากประเทศจีนโกดังไม่มีโลโก้ LIECTROUX พิมพ์บนหุ่นยนต์ แต่ระหว่าง Busy Season และพิเศษเวลา เราสต็อกบางหุ่นยนต์ไม่มี LIECTROUX โลโก้ต่างประเทศคลังสินค้า SO We Can ตรวจสอบให้แน่ใจว่าหุ่นยนต์จัดส่งให้คุณกับ LIECTROUX โลโก้ What We Can Make Sure เป็นหุ่นยนต์ขายนี้ Store และจัดส่งคุณทำจาก LIECTROUX บริษัท กรุณายืนยันได้ยอมรับนี้ก่อนซื้อ.. ถ้าเลือก IML บางครั้งเราทำจัดส่งโดย Pony โพสต์รัสเซียฯลฯตามสถานการณ์จริง กรุณายืนยันได้ยอมรับนี้ก่อนซื้อ.. ถ้าเลือก IML บางครั้งเราทำจัดส่งโดย Pony โพสต์รัสเซียฯลฯตามสถานการณ์จริง กรุณายืนยันได้ยอมรับนี้ก่อนซื้อ.คุณสมบัติ ดูดที่มีประสิทธิภาพอัจฉริยะดูดปรับ . Considerate Designs .ทำความสะอาดต่างๆโหมด .ชิ้นส่วน No. หลักหน่วย ..... PCNo. Self ชาร์จฐาน ..... PCNo. รีโมทคอนโทรล รวมแบตเตอรี่ ..... PCNo. Virtual Blocker ไม่รวมแบตเตอรี่ ..... PCNo. อะแดปเตอร์ AC ..... PCNo. แปรงทำความสะอาดเครื่องมือ ..... PCNO. อะไหล่แปรงด้านข้าง ...... PCNo. HEPA กรอง ....... PCNo. คู่มือผู้ใช้ ...... PCชื่อผลิตภัณฑ์ มัลติฟังก์ชั่เครื่องดูดฝุ่นหุ่นยนต์หมายเลขสินค้า B หมายเหตุ หมายเหตุ .ถ้าส่งจากต่างประเทศโกดังมีโลโก้ LIECTROUX พิมพ์บนหุ่นยนต์ ถ้าส่งจากประเทศจีนโกดังไม่มีโลโก้ LIECTROUX พิมพ์บนหุ่นยนต์ แต่ระหว่าง Busy Season และพิเศษเวลา เราสต็อกบางหุ่นยนต์ไม่มี LIECTROUX โลโก้ต่างประเทศคลังสินค้า SO We Can ตรวจสอบให้แน่ใจว่าหุ่นยนต์จัดส่งให้คุณกับ LIECTROUX โลโก้ What We Can Make Sure เป็นหุ่นยนต์ขายนี้ Store และจัดส่งคุณทำจาก LIECTROUX บริษัท กรุณายืนยันได้ยอมรับนี้ก่อนซื้อ. .ถ้าส่งจากต่างประเทศโกดังมีโลโก้ LIECTROUX พิมพ์บนหุ่นยนต์ ถ้าส่งจากประเทศจีนโกดังไม่มีโลโก้ LIECTROUX พิมพ์บนหุ่นยนต์ แต่ระหว่าง Busy Season และพิเศษเวลา เราสต็อกบางหุ่นยนต์ไม่มี LIECTROUX โลโก้ต่างประเทศคลังสินค้า SO We Can ตรวจสอบให้แน่ใจว่าหุ่นยนต์จัดส่งให้คุณกับ LIECTROUX โลโก้ What We Can Make Sure เป็นหุ่นยนต์ขายนี้ Store และจัดส่งคุณทำจาก LIECTROUX บริษัท กรุณายืนยันได้ยอมรับนี้ก่อนซื้อ.. ถ้าเลือก IML บางครั้งเราทำจัดส่งโดย Pony โพสต์รัสเซียฯลฯตามสถานการณ์จริง กรุณายืนยันได้ยอมรับนี้ก่อนซื้อ.. ถ้าเลือก IML บางครั้งเราทำจัดส่งโดย Pony โพสต์รัสเซียฯลฯตามสถานการณ์จริง กรุณายืนยันได้ยอมรับนี้ก่อนซื้อ.คุณสมบัติ ดูดที่มีประสิทธิภาพอัจฉริยะดูดปรับ . Considerate Designs .ทำความสะอาดต่างๆโหมด .ชิ้นส่วน No. หลักหน่วย ..... PCNo. Self ชาร์จฐาน ..... PCNo. รีโมทคอนโทรล รวมแบตเตอรี่ ..... PCNo. Virtual Blocker ไม่รวมแบตเตอรี่ ..... PCNo. อะแดปเตอร์ AC ..... PCNo. แปรงทำความสะอาดเครื่องมือ ..... PCNO. อะไหล่แปรงด้านข้าง ...... PCNo. HEPA กรอง ....... PCNo. คู่มือผู้ใช้ ...... PC,https://ae01.alicdn.com/kf/HTB1qSICbifrK1RjSspbq6A4pFXaX/LIECTROUX-B3000-Wet-Dry-WithTone-virtual-Blocker.jpg_80x80.jpg_.webp,19150.0,0,0.0,0,https://th.aliexpress.com/item/32807521791.html?algo_pvid=49fae7c5-61e6-4d44-8452-b32bce867f75&aem_p4p_detail=20240701024440708063421176120005029278&algo_exp_id=49fae7c5-61e6-4d44-8452-b32bce867f75-23&pdp_npi=4%40dis%21THB%2119150.33%2119150.33%21%21%21506.36%21506.36%21%402101e81117198270800435871ed87c%2164483405788%21sea%21TH%210%21AB&curPageLogUid=Ie0xbP3bDOgS&utparam-url=scene%3Asearch%7Cquery_from%3A&search_p4p_id=20240701024440708063421176120005029278_6,Oversea,0.0,Liectroux,,
, ชิ้น แผ่น ผ้า ถู พื้น สำหรับ T หุ่น ยนต์ Deebot ozmo T PLUS อะไหล่ ทดแทน อะไหล่ เครื่อง ดูด ฝุ่น หุ่น ยนต์,,https://ae01.alicdn.com/kf/S69540551776b4e678701b0de636255cbr/10-T10-Deebot-ozmo-T10-PLUS.jpg_.webp,254.53,0,0.0,0,https://th.aliexpress.com/item/1005007140214102.html?algo_pvid=49fae7c5-61e6-4d44-8452-b32bce867f75&algo_exp_id=49fae7c5-61e6-4d44-8452-b32bce867f75-24&pdp_npi=4%40dis%21THB%21380.09%21254.53%21%21%2110.05%216.73%21%402101e81117198270800435871ed87c%2112000039547958341%21sea%21TH%210%21AB&curPageLogUid=wnX6Kg7MTPNv&utparam-url=scene%3Asearch%7Cquery_from%3A,Oversea,0.0,No brand,,
, PA เครื่อง ฟอก อากาศ ทรง พลัง ดูด แรง สูง พลัง สูงเครื่อง ทำ ความ สะอาด แบบ พกพา ทรง พลัง ใช้ งาน ได้ สอง ทาง สำหรับ บ้าน และ รถ ยนต์,เครื่องดูดฝุ่นแบบมือจับไร้สาย PA W พลังสูงเครื่องทำความสะอาดพลังงานอัตโนมัติเต็มรูปแบบสำหรับบ้านและรถยนต์คุณสมบัติ .แรงดูดที่ทรงพลัง เครื่องดูดฝุ่นในรถยนต์แบบไร้สายมีมอเตอร์กำลังสูง W ที่ให้ดูดแรงสูงได้สูงสุด Kpa เก็บผมได้อย่างง่ายดายเศษอาหารที่ตกค้างอนุภาคและเศษซากเล็กเท่า . ไมครอนที่ซ่อนอยู่ในโซฟาหมอนอิงและอื่นๆ มันเป็นตัวเลือกที่ชาญฉลาดสำหรับรถปิคอัพอย่างรวดเร็วการล้างรถและการทำความสะอาดบ้าน .อุปกรณ์เสริมอเนกประสงค์ มาพร้อมกับหัวแปรงที่หลากหลายที่จับฝุ่นนี้สามารถทำความสะอาดได้ทุกมุมของเบาะรถยนต์รอยแยกเสื่อปูพื้นและลำต้นเพื่อให้มั่นใจได้ถึงประสบการณ์การทำความสะอาดอย่างละเอียดโดยไม่ทิ้งรอยใดๆ .ทำความสะอาดได้ทันทีด้วยการดูดที่มีศักยภาพ ด้วยความสามารถในการดึงดูดเศษขยะต่างๆขนสัตว์เลี้ยงควันถ่านหินและคราบน้ำได้อย่างรวดเร็วเครื่องดูดฝุ่นมือถือไร้สายช่วยให้พื้นที่ของคุณไร้ที่ติในเวลาไม่กี่วินาทีนำเสนอความสามารถในการปัดฝุ่นอากาศอันทรงพลังในรูปแบบกะทัดรัด .น้ำหนักเบาและพกพาได้ ความสะดวกในการพกพาเครื่องทำความสะอาดแบบพกพาขนาดเล็กนี้ทำให้คุณไม่ต้องใช้เครื่องจักรขนาดใหญ่ทำให้คุณสามารถทำความสะอาดบันไดห้องครัวพื้นพรมรถยนต์และจุดที่เข้าถึงยากได้อย่างง่ายดายที่ไม่มีใครเทียบได้ทั้งหมดนี้ต้องขอบคุณการออกแบบแบบไร้สาย .ชาร์จ USB ชาร์จเครื่องฟอกอากาศที่ทรงพลังของคุณโดยใช้แล็ปท็อป พีซี แบตสำรอง ที่ชาร์จ USB หรือที่ชาร์จใดๆที่มีพอร์ต USB ที่ให้ความสะดวกและยืดหยุ่นในการทำให้พื้นที่ของคุณสะอาดไม่ว่าจะอยู่ที่บ้านหรือขณะเดินทาง ข้อมูลจำเพาะ แหล่งกำเนิด จีนแผ่นดินใหญ่ x x x x,https://ae01.alicdn.com/kf/Sf54b9ff356e04120902d0136bebc9823W/6000PA.jpg_80x80.jpg_.webp,89.98,1,0.0,0,https://th.aliexpress.com/item/1005007208272085.html?algo_pvid=49fae7c5-61e6-4d44-8452-b32bce867f75&algo_exp_id=49fae7c5-61e6-4d44-8452-b32bce867f75-25&pdp_npi=4%40dis%21THB%21489.03%2189.98%21%21%2194.37%2117.36%21%402101e81117198270800435871ed87c%2112000039810554576%21sea%21TH%210%21AB&curPageLogUid=KYHwIZ7KJWm7&utparam-url=scene%3Asearch%7Cquery_from%3A,Oversea,0.0,alloet,,
,เครื่อง ดูด ฝุ่น ขนาด เล็ก ตั้ง โต๊ะ แบบ พก พา ที่ ดูด ฝุ่น ยูเอสบีชาร์จ ได้ พร้อม หัว ฉีด ที่ ถอด ออก ได้ เครื่องมือ ทำ ความ สะอาด เศษ ดิน สอ ทำ ผม สัตว์ เลี้ยง,เครื่องดูดฝุ่นขนาดเล็กตั้งโต๊ะแบบพกพาที่ดูดฝุ่นยูเอสบีชาร์จได้พร้อมหัวฉีดที่ถอดออกได้เครื่องมือทำความสะอาดเศษดินสอทำผมสัตว์เลี้ยง คุณสมบัติ .หัวฉีดที่ถอดออกได้ เครื่องดูดฝุ่นตั้งโต๊ะขนาดเล็กไร้สายของเรามาพร้อมกับหัวฉีดที่ถอดออกได้เพื่อง่ายต่อการทำความสะอาดมุมที่ยากต่อการเข้าถึงและฝุ่นหรือเศษขยะขนาดเล็ก รูปลักษณ์ที่เหมือนหุ่นยนต์น่ารักทำให้เหมาะสำหรับการใช้งานเดสก์ท็อป .แบตเตอรี่แบบชาร์จไฟได้ อุปกรณ์ทำความสะอาดแป้นพิมพ์ยูเอสบีของเรามีแบตเตอรี่แบบชาร์จไฟได้ในตัวที่สามารถชาร์จผ่านแหล่งต่างๆเช่นโทรศัพท์มือถือคอมพิวเตอร์อะแดปเตอร์ที่ชาร์จในรถยนต์หรือที่เสียบ USB ช่วยให้คุณมีตัวเลือกการชาร์จที่สะดวก .พลังงานดูดแรงสูง เครื่องดูดฝุ่นตั้งโต๊ะขนาดเล็กของเรามีกำลังดูดแรงสูงช่วยให้สามารถสะสมฝุ่นขนสัตว์เลี้ยงและเศษขยะได้อย่างมีประสิทธิภาพ มันทำงานอย่างเงียบๆโดยไม่รบกวนผู้อื่นรอบตัวคุณ .ใช้งานง่าย ด้วยเครื่องดูดฝุ่นขนาดเล็กน่ารักนี้คุณสามารถกำจัดฝุ่นเศษกระดาษขนสัตว์เลี้ยงและเศษขยะจากพื้นผิวโต๊ะหรือเดสก์ท็อปได้อย่างง่ายดาย การออกแบบที่กะทัดรัดทำให้สามารถรวบรวมทุกอย่างตั้งแต่ขนสัตว์เลี้ยงและกระดาษสีไปจนถึงเมล็ดแอปเปิ้ลและกรวดบนขอบหน้าต่างที่นั่งในรถและแป้นพิมพ์คอมพิวเตอร์ .การใช้งานอเนกประสงค์ เครื่องดูดฝุ่นตั้งโต๊ะขนาดเล็กของเราเหมาะสำหรับสำนักงานที่บ้านรถยนต์และพื้นที่ทำงานอื่นๆ ขนาดกะทัดรัดและพกพาทำให้เหมาะสำหรับเก็บผมสัตว์เลี้ยงกระดาษสีกรวดและเศษเล็กๆอื่นๆจากโต๊ะพรมและคีย์บอร์ด ข้อมูลจำเพาะ สี สีขาวสีดำ อุปกรณ์เสริม ขนาด ประมาณ . * ซม. . * . นิ้ววัสดุ พลาสติก + ชิ้นส่วนอิเล็กทรอนิกส์แบตเตอรี่ มิลลิแอมป์ชั่วโมง หมายเหตุ สีที่แท้จริงของสินค้าอาจแตกต่างจากสีที่แสดงในรูปเล็กน้อยเนื่องจากมีการแสดงผลและเอฟเฟกต์แสงที่แตกต่างกัน ขอบคุณ โปรดยอมรับความคลาดเคลื่อนในการวัด - ซม. เนื่องจากการวัดด้วยมือเครื่องดูดฝุ่นขนาดเล็กตั้งโต๊ะแบบพกพาที่ดูดฝุ่นยูเอสบีชาร์จได้พร้อมหัวฉีดที่ถอดออกได้เครื่องมือทำความสะอาดเศษดินสอทำผมสัตว์เลี้ยง คุณสมบัติ ข้อมูลจำเพาะ สี สีขาวสีดำ อุปกรณ์เสริม ขนาด ประมาณ . * ซม. . * . นิ้ววัสดุ พลาสติก + ชิ้นส่วนอิเล็กทรอนิกส์แบตเตอรี่ มิลลิแอมป์ชั่วโมง x เครื่องดูดฝุ่นขนาดเล็ก ,https://ae01.alicdn.com/kf/S15cdf3a0f086412189cdea87fa51aff72/-.jpg_.webp,173.9,0,0.0,0,https://th.aliexpress.com/item/1005007234739988.html?algo_pvid=49fae7c5-61e6-4d44-8452-b32bce867f75&algo_exp_id=49fae7c5-61e6-4d44-8452-b32bce867f75-26&pdp_npi=4%40dis%21THB%21561.00%21173.90%21%21%21108.26%2133.56%21%402101e81117198270800435871ed87c%2112000039903994899%21sea%21TH%210%21AB&curPageLogUid=3FUypr6Ls6GV&utparam-url=scene%3Asearch%7Cquery_from%3A,Oversea,0.0,ANENG,,
,ตัว กรอง Dyson SV ไซโคลน เครื่อง ดูด ฝุ่น ไร้ สาย สามารถ ซัก ได้ อะไหล่ หลัง กรอง ได้ สำหรับ Dyson V อุปกรณ์ เสริม, .เราแนะนำให้คุณชำระเงินออนไลน์หากคุณต้องการข้อมูลเพิ่มเติมโปรดติดต่อเรา .ต้องชำระเงินภายใน วันหลังจากสั่งซื้อมิฉะนั้นคำสั่งซื้อจะถูกยกเลิกโดยระบบ .โปรดตรวจสอบให้แน่ใจว่าคุณได้กรอกข้อมูลโดยละเอียดทั้งหมดเช่นผู้ติดต่อ ชื่อเต็มของรัสเซีย ที่อยู่และหมายเลขโทรศัพท์บอกเมื่อกรอกข้อมูลผู้ซื้อของคุณ .กรุณากรอกที่อยู่ที่ถูกต้องรวมถึงเลขที่อพาร์ตเมนต์ของคุณถนนเมืองภูมิภาคและประเทศ .หากการดำเนินการไม่พร้อมใช้งานหรือไม่ถูกต้องระบบการจองของคุณจะถูกยกเลิก .หากการดำเนินการไม่พร้อมใช้งานหรือไม่ถูกต้องระบบการจองของคุณจะถูกยกเลิก เราสามารถจัดส่งสินค้าผ่าน AliExpress สามัญและ AliExpress พัสดุขนาดเล็กที่เรียบง่าย เวลามาถึงช้ามากเวลามาถึงโดยเฉลี่ยประมาณ - วันแต่คุณต้องรอ - วันในช่วงฤดูท่องเที่ยว .หากคุณต้องการให้เราส่งสินค้าของคุณผ่าน AliExpress อย่างรวดเร็วโปรดติดต่อเราสำหรับค่าจัดส่ง .เราจะส่งสินค้าส่วนใหญ่ภายใน - วันทำการหลังจากยืนยันการชำระเงินเต็มจำนวน .ผู้ซื้อเป็นผู้รับผิดชอบการประกันภัยปัญหาและความเสียหายที่เกิดจากบริการจัดส่งเช่นอุบัติเหตุการล่าช้าหรือปัญหาอื่นๆ นอกจากนี้ผู้ซื้อจะต้องรับผิดชอบต่อภาษีและ หรืออากรที่กำหนดโดยประเทศของตน,https://ae01.alicdn.com/kf/S2ec4ecbb58494fff89091cf41287f95dn/Dyson-SV12.jpg_.webp,153.14,6,5.0,1,https://th.aliexpress.com/item/1005006976219185.html?algo_pvid=49fae7c5-61e6-4d44-8452-b32bce867f75&aem_p4p_detail=20240701024440708063421176120005029278&algo_exp_id=49fae7c5-61e6-4d44-8452-b32bce867f75-27&pdp_npi=4%40dis%21THB%21209.87%21153.14%21%21%2140.50%2129.55%21%402101e81117198270800435871ed87c%2112000038912050344%21sea%21TH%210%21AB&curPageLogUid=bBJGtXQU967I&utparam-url=scene%3Asearch%7Cquery_from%3A&search_p4p_id=20240701024440708063421176120005029278_7,Oversea,0.0,No brand,,
