productID,productName,productDes,image,price,sold_units,rating,no_review,link,shipmentOrigin,delivery_fee,brand,CatID,PlatID
,เครื่อง ดูด ฝ่น ขนาด เล็ก แบบ พกพา แบบ พกพา เครื่อง ดูด ฝ่น ขนาด เล็ก สำหรับ ยานพาหนะ อเนกประสงค์,การแนะนำผลิตภัณฑ์ การถอดและทำความสะอาด คำแนะนำสำหรับการใช้งาน หมายเหตุ ,https://ae01.alicdn.com/kf/Sc46d9c9f18d54be79647436e09f021aa7/-.jpg_.webp,108.79,22,3.2,5,https://th.aliexpress.com/item/1005006849775298.html?algo_pvid=5282cf8f-365c-4250-a2c0-5ac28688c1b0&algo_exp_id=5282cf8f-365c-4250-a2c0-5ac28688c1b0-34&pdp_npi=4%40dis%21THB%21359.84%21108.79%21%21%2169.44%2120.99%21%402101fb1617198271132077205e6a1b%2112000038509466655%21sea%21TH%210%21AB&curPageLogUid=7fQC9tM3JyhG&utparam-url=scene%3Asearch%7Cquery_from%3A,Oversea,0.0,No brand,,
, ชิ้น อุปกรณ์ แปรง เตียง สุนัข แมว สัตว์ เลี้ยง แบบ สุญญากาศ อุปกรณ์ สำหรับ เจ้า บ่าว ใช้ ได้ กับ Dyson V V V อะไหล่ เครื่อง ดูด ฝุ่น V V ,สายต่อและ Trigger Lock สำหรับ Dyson-สายยางและสวิทช์สำหรับ Dyson V V V V V สูญญากาศทำความสะอาดUSD . pieceชุดหัวไม้ถูพื้นไฟฟ้าสำหรับ Dyson V V V V V ชิ้นส่วนเครื่องดูดฝุ่นแผ่นไม้ถูพื้นเปียกติดกับถังเก็บน้ำผ้าเศษผ้าทำความสะอาดUSD . - . pieceสำหรับเครื่องดูดฝุ่น V V V Dyson V แปรงขนนุ่มแปรงดูดฝุ่นอุปกรณ์เสริมแปรงเครื่องมือแปรงทำความสะอาดช่องว่างไม่ยุ่งยากUSD . - . pieceแปรงทำความสะอาดสุนัขแมวสัตว์เลี้ยงแปรงเตียงเจ้าบ่าวและชุดกล่องเครื่องมือสายยางสำหรับ Dyson V V V V V ชิ้นส่วน G USD . - . pieceหัวแปรงทำความสะอาดสำหรับ Dyson V V V V V รุ่นที่ดูดฝุ่นไม้แข็งพื้นแปรงที่แนบมาเปลี่ยนUSD . piece Pcs สูญญากาศสิ่งที่แนบมาแปรงทำความสะอาดและท่อชุดกล่องเครื่องมือสำหรับ Dyson V V V V V USD . - . pieceเรามีส่วนลดขนาดใหญ่จำนวน. ยินดีต้อนรับสู่ติดต่อ เจ้าบ่าวเครื่องมือ สำหรับ Dyson V V V V V เครื่องดูดฝุ่น QUICK RELEASE อะแดปเตอร์แปลงTrigger LOCK สำหรับ Dyson V V V V V เครื่องดูดฝุ่นไร้สาย it จะเป็นประโยชน์สำหรับๆทำความสะอาดสะดวกสายต่อขยายแบบยืดหยุ่น ใช้งานร่วมกับ Dyson V ขนาดใหญ่ v V V V ABSOLUTE สัตว์ Motorhead ไร้สายเครื่องดูดฝุ่น ถึง นิ้ว ไม่มี Getting ปวดนิ้วมือ ใหม่ Trigger LOCK ทำให้คุณใช้สูญญากาศได้ง่ายและสะดวกโดยติดตั้งบนปุ่มของ Dyson ไร้สายเครื่องดูดฝุ่น ไม่มีเก็บกดปุ่มในขณะที่การดูดฝุ่นสี สีเทา + สีแดงวัสดุ ABSเพียงด้านบนแพคเกจเนื้อหาอื่นๆผลิตภัณฑ์ไม่รวมหมายเหตุ การถ่ายภาพอาจทำให้สีเล็กน้อยที่แตกต่างกันจริง. ข้อผิดพลาดที่อนุญาตคือ + - - ซม.,https://ae01.alicdn.com/kf/S50fcae6e65dd4a03bae59b00b8749a42K/4.jpg_.webp,37.44,377,4.6,49,https://th.aliexpress.com/item/1005004825770541.html?algo_pvid=5282cf8f-365c-4250-a2c0-5ac28688c1b0&aem_p4p_detail=2024070102451334294150035340004908405&algo_exp_id=5282cf8f-365c-4250-a2c0-5ac28688c1b0-35&pdp_npi=4%40dis%21THB%2151.81%2137.44%21%21%211.37%210.99%21%402101fb1617198271132077205e6a1b%2112000033251827653%21sea%21TH%210%21AB&curPageLogUid=EQZ7NnqsyvFV&utparam-url=scene%3Asearch%7Cquery_from%3A&search_p4p_id=2024070102451334294150035340004908405_9,Oversea,0.0,No brand,,
,เครื่อง ดูด ฝุ่น ใน รถ ยนต์ แบบ ไร้ สาย ชาร์จผ่าน USB PA mAh เครื่อง ดูด ฝุ่น ขนาด เล็ก ใช้ ใน ครัวเรือน ทั้ง แบบ เปียก และ แห้ง,,https://ae01.alicdn.com/kf/S095aa2fd8fa746a1975f8a1a387b3231o/USB-9000PA-1200mAh.jpg_.webp,68.08,0,0.0,0,https://th.aliexpress.com/item/1005007202335226.html?algo_pvid=5282cf8f-365c-4250-a2c0-5ac28688c1b0&algo_exp_id=5282cf8f-365c-4250-a2c0-5ac28688c1b0-36&pdp_npi=4%40dis%21THB%21113.46%2168.08%21%21%213.00%211.80%21%402101fb1617198271132077205e6a1b%2112000039788847108%21sea%21TH%210%21AB&curPageLogUid=sGtNBoxy3RUG&utparam-url=scene%3Asearch%7Cquery_from%3A,Oversea,142.78,Strgomea,,
,เครื่อง ดูด ฝุ่น ใน รถ ยนต์ PA เครื่อง ทำ ความ สะอาด ขนาด เล็ก ดูด แรง สูง USB แบบ มือถือ สำหรับ เครื่อง ใช้ ใน บ้าน รถ ยนต์ เครื่อง ทำ ความ สะอาด ไร้ สาย แบบ พกพา,การแนะนำ ชื่อผลิตภัณฑ์ เครื่องดูดฝุ่นในรถยนต์แบบมือถือ การทำงานของผลิตภัณฑ์ ส่วนใหญ่ทำความสะอาดรถยนต์ดูดฝุ่นเป่าลูกโป่งและอื่นๆแนะนำเวอร์ชัน เวอร์ชันอัปเดต วัสดุของผลิตภัณฑ์ ABS มอเตอร์ มอเตอร์ไร้แปรงอัปเกรดใหม่ สูญญากาศองศา PA ความเร็ว รอบต่อนาที ความจุของแบตเตอรี่ลิเธียม * มิลลิแอมป์ โหมดการชาร์จ สายชาร์จ Type-C เสียงรบกวน dB อุณหภูมิในการทำงาน - + รายการแพ็คเกจ X ทำความสะอาดสูญญากาศ อุปกรณ์เสริม x X สายชาร์จ ManualX ผู้ใช้ น้ำหนัก กรัม เวอร์ชันพื้นฐาน วัสดุของผลิตภัณฑ์ ABS มอเตอร์ มอเตอร์ธรรมดา สูญญากาศองศา PA ความเร็ว รอบต่อนาที ความจุของแบตเตอรี่ลิเธียม * มิลลิแอมป์ โหมดการชาร์จ สายชาร์จ Type-C เสียงรบกวน dB อุณหภูมิในการทำงาน - + รายการแพ็คเกจ X ทำความสะอาดสูญญากาศ อุปกรณ์เสริม x X สายชาร์จ ManualX ผู้ใช้ น้ำหนัก กรัม,https://ae01.alicdn.com/kf/S45afdba2afe34fb3a8589fbe70deb590H/98000PA.jpg_80x80.jpg_.webp,417.83,5000,4.2,867,https://th.aliexpress.com/item/1005006105400075.html?algo_pvid=5282cf8f-365c-4250-a2c0-5ac28688c1b0&algo_exp_id=5282cf8f-365c-4250-a2c0-5ac28688c1b0-37&pdp_npi=4%40dis%21THB%211530.81%21417.83%21%21%21295.41%2180.63%21%402101fb1617198271132077205e6a1b%2112000035767834390%21sea%21TH%210%21AB&curPageLogUid=Vy2jiuPxiDot&utparam-url=scene%3Asearch%7Cquery_from%3A,Oversea,0.0,szuk,,
,เครื่อง เป่า ลม สำหรับ ทำ ความ สะอาด รถ ขนาด เล็ก PA เครื่อง เป่า ลม สำหรับ ทำ ความ สะอาด เครื่อง ใช้ ใน บ้าน แบบ ไร้ สาย,การแนะนำแนะนำเวอร์ชัน เวอร์ชันมืออาชีพ มอเตอร์ มอเตอร์ไร้แปรงถ่านอัพเกรดใหม่ สี สีดำสง่างาม สูญญากาศองศา PA เวอร์ชันพื้นฐาน มอเตอร์ มอเตอร์แปรง Color สีน้ำเงินเย้ายวนใจ สูญญากาศองศา PA,https://ae01.alicdn.com/kf/S394ddf0bacf148a2aa912095d5423788m/140000PA.png_80x80.png_.webp,459.75,0,0.0,0,https://th.aliexpress.com/item/1005007159047915.html?algo_pvid=5282cf8f-365c-4250-a2c0-5ac28688c1b0&algo_exp_id=5282cf8f-365c-4250-a2c0-5ac28688c1b0-38&pdp_npi=4%40dis%21THB%211483.04%21459.75%21%21%21286.19%2188.72%21%402101fb1617198271132077205e6a1b%2112000039919641248%21sea%21TH%210%21AB&curPageLogUid=ig72hO75h4MH&utparam-url=scene%3Asearch%7Cquery_from%3A,Oversea,0.0,CENRR,,
,Camason รถ เครื่อง ดูด ฝุ่น สำหรับ รถ ยนต์ และ บ้าน Mini Wireless แห้ง ทำ ความ สะอาด เครื่องมือ สินค้า รถ ยนต์ แบบ พกพา แบบ พกพา เครื่อง ดูด ฝุ่น หุ่น ยนต์ ทำ ความ สะอาด,Camason รถ Jump Starter Power Bank A ราคาเริ่มต้นที่อุปกรณ์แบตเตอรี่รถยนต์ฉุกเฉินฉุกเฉิน Booster Charger Jump Start Up สำหรับรถยนต์USD . - . pieceCamason รถ Jump Starter ไฟฉายราคาเริ่มต้นที่อุปกรณ์แบตเตอรี่แบตสำรองฉุกเฉิน Booster เบนซินดีเซลเริ่มต้น ChargerUSD . pieceCamason สมาร์ทเครื่องสูบลมแบบพกพารถอัตโนมัติคอมเพรสเซอร์ยาง Inflator สำหรับรถจักรยานยนต์จักรยานบาสเกตบอล InflatableUSD . pieceCamason W Car Quick Charger USB Type C สำหรับ Iphone Xiaomi Huawei โทรศัพท์ PD QC . V V Fast Charging Adapter ผลิตภัณฑ์USD . - . pieceรถ A Jump Starter คอมเพรสเซอร์แบบพกพาไฟฉายราคาเริ่มต้นที่อุปกรณ์แบตสำรองแบตเตอรี่ยานยนต์ Booster เริ่มต้นUSD . - . pieceCamason รถ Jump Starter Power Bank A ราคาเริ่มต้นที่อุปกรณ์แบตเตอรี่รถยนต์ฉุกเฉินฉุกเฉิน Booster Charger Jump Start Up สำหรับรถยนต์USD . - . pieceCamason แบบชาร์จไฟได้ปั๊ม Inflator ไร้สายแบบพกพาคอมเพรสเซอร์ดิจิตอลยางรถยนต์สำหรับรถยนต์จักรยานยางลูกบอลUSD . pieceCamason แบบชาร์จไฟได้ปั๊ม Inflator ไร้สายแบบพกพาคอมเพรสเซอร์ดิจิตอลยางรถยนต์สำหรับรถยนต์จักรยานยางลูกบอลUSD . pieceเครื่องดูดฝุ่นรถยนต์เครื่องดูดฝุ่นในรถยนต์นี้มีแบตเตอรี่ในตัวและไม่จำเป็นต้องเชื่อมต่อกับแหล่งจ่ายไฟภายนอกเมื่อทำงานซึ่งใช้งานได้สะดวกกว่า ยิ่งไปกว่านั้นมันมีพลังดูดแรงสูงซึ่งสามารถทำความสะอาดฝุ่นในทุกมุมของรถได้อย่างง่ายดาย ขนาดเล็กพกพาและใช้งานง่าย รถยนต์หรือบ้านเหมาะมากสำหรับการใช้งาน ฝุ่น เส้นผมและเศษขยะต่างๆจะถูกดูดออกไปได้อย่างง่ายดายแรงดูดสูงพลังดูดสูงสามารถทำความสะอาดฝุ่นได้อย่างง่ายดาย การสวมใส่ส่วนต่อประสานส่วนขยายสามารถขยายช่วงการเก็บฝุ่นของเครื่องดูดฝุ่นได้ สามารถทำความสะอาดมุมหรือรอยแยกได้ข้อดีของผลิตภัณฑ์ น้ำหนักเบา เสียงรบกวนต่ำ ดูดแรงสูงมือถือไร้สายสะดวกในการใช้ไม่จำเป็นต้องใช้สายเคเบิลการออกแบบมือถือทำให้เครื่องดูดฝุ่นปราศจากข้อจำกัดของสายไฟแบตเตอรี่ลิเธียมแบบชาร์จไฟได้ในตัวที่มีความจุ มิลลิแอมป์ต่อชั่วโมง สามารถใช้งานได้นานในการชาร์จครั้งเดียวอินเทอร์เฟซการชาร์จชนิด Cใช้อินเตอร์เฟซสากล Type-C ชาร์จง่ายตัวกรองสามารถถอดออกเพื่อทำความสะอาดส่วนต่อประสานส่วนขยายภายนอกรายการบรรจุภัณฑ์ประกอบด้วยพอร์ตต่อขยายภายนอกสองพอร์ตเพื่ออำนวยความสะดวกในการทำความสะอาดฝุ่นในมุมและรอยแยกขนาดเล็กง่ายต่อการจัดเก็บและพกพาพารามิเตอร์ทางเทคนิครุ่นผลิตภัณฑ์ HK ชื่อสินค้า เครื่องดูดฝุ่นแบบพกพาแรงดันไฟฟ้าที่ชาร์จ DC Vความจุแบตเตอรี่ mAhกระแสไฟที่ชาร์จ MAน้ำหนักสุทธิ ประมาณ กรัมกำลังไฟที่ได้รับการจัดอันดับ Wขนาด . x . x mmรายการบรรจุ,https://ae01.alicdn.com/kf/Sc5dd8b03f4314c20a07f196f3c466475L/Camason-Mini-Wireless.jpg_80x80.jpg_.webp,226.92,0,0.0,0,https://th.aliexpress.com/item/1005004225471944.html?algo_pvid=5282cf8f-365c-4250-a2c0-5ac28688c1b0&aem_p4p_detail=2024070102451334294150035340004908405&algo_exp_id=5282cf8f-365c-4250-a2c0-5ac28688c1b0-39&pdp_npi=4%40dis%21THB%211512.41%21226.92%21%21%2139.99%216.00%21%402101fb1617198271132077205e6a1b%2112000028442602645%21sea%21TH%210%21AB&curPageLogUid=mOlT2y0YyNy4&utparam-url=scene%3Asearch%7Cquery_from%3A&search_p4p_id=2024070102451334294150035340004908405_10,Oversea,255.57,Camason,,
,อะไหล่ แบตเตอรี่ สำรอง สำหรับ หุ่น ยนต์ ดูด ฝุ่น Xiaomi S อะไหล่ เครื่อง ดูด ฝุ่น อะไหล่ แบตเตอรี่ Li - ion,,https://ae01.alicdn.com/kf/S6b4e4066634e4a4898fb4c915c54a9adN/Xiaomi-S10.jpg_.webp,874.31,1,1.0,1,https://th.aliexpress.com/item/1005005693134921.html?algo_pvid=5282cf8f-365c-4250-a2c0-5ac28688c1b0&algo_exp_id=5282cf8f-365c-4250-a2c0-5ac28688c1b0-40&pdp_npi=4%40dis%21THB%211533.87%21874.31%21%21%21296.00%21168.72%21%402101fb1617198271132077205e6a1b%2112000034029760183%21sea%21TH%210%21AB&curPageLogUid=S6IquJRYnjgA&utparam-url=scene%3Asearch%7Cquery_from%3A,Oversea,164.1,MIJIA,,
, มิลลิแอมป์ ต่อ ชั่วโมง เครื่อง ดูด ฝุ่น แบบ มือ จับ และ เครื่อง เป่า USB ไร้ สาย ขนาด เล็ก เครื่องมือ ทำ ความ สะอาด สูญญากาศ สำหรับ บ้าน รถ ยนต์ เปียก แห้ง,,https://ae01.alicdn.com/kf/S8a39c12f161149baa0cfe5217768ed13x/1800-USB.jpg_.webp,285.68,0,0.0,0,https://th.aliexpress.com/item/1005006988358444.html?algo_pvid=5282cf8f-365c-4250-a2c0-5ac28688c1b0&algo_exp_id=5282cf8f-365c-4250-a2c0-5ac28688c1b0-41&pdp_npi=4%40dis%21THB%21285.68%21285.68%21%21%2155.13%2155.13%21%402101fb1617198271132077205e6a1b%2112000038964088773%21sea%21TH%210%21AB&curPageLogUid=ZlIR4nUcCVKr&utparam-url=scene%3Asearch%7Cquery_from%3A,Oversea,37.36,Atuwebo,,
,เครื่อง ดูด ฝุ่น ใน รถ ไร้ สาย แบบ มือถือ อเนกประสงค์ I N ไร้ สาย มี พลังงาน PA - เหมาะ สำหรับ ล้าง รถ ภาย ใน - รวม,,https://ae01.alicdn.com/kf/Sf8dc8df2c2bf4c0f8cb1e5de8045a0079/3IN1-9000.jpg_.webp,607.43,0,0.0,0,https://th.aliexpress.com/item/1005007253087200.html?algo_pvid=5282cf8f-365c-4250-a2c0-5ac28688c1b0&algo_exp_id=5282cf8f-365c-4250-a2c0-5ac28688c1b0-42&pdp_npi=4%40dis%21THB%21607.43%21607.43%21%21%21117.22%21117.22%21%402101fb1617198271132077205e6a1b%2112000039955724064%21sea%21TH%210%21AB&curPageLogUid=TqF7NdPbBwxv&utparam-url=scene%3Asearch%7Cquery_from%3A,Oversea,0.0,No brand,,
,S ไร้ สาย มือถือ เครื่อง ดูด ฝุ่น W kPa ดูด IN ตรง เครื่อง ดูด ฝุ่น LED ไฟ ตรวจ จับ ฝุ่น มัลติฟังก์ ชั่บ้าน สำหรับ รถ ยนต์ กำจัด ไร ฝุ่น,โปรดคัดลอกรหัสส่วนลดนี้- และวางรหัสนี้เมื่อคุณชำระเงิน SSS เครื่องดูดฝุ่น kPa S ไร้สาย W เครื่องดูดฝุ่นแนวตั้ง in เครื่องกำจัดไรฝุ่นอเนกประสงค์,https://ae01.alicdn.com/kf/S894f9a9e8ab8453484f334bc014b1d98F/S14-250W-28kPa-8IN-1.jpg_80x80.jpg_.webp,4741.0,0,0.0,0,https://th.aliexpress.com/item/1005007180829781.html?algo_pvid=5282cf8f-365c-4250-a2c0-5ac28688c1b0&aem_p4p_detail=2024070102451334294150035340004908405&algo_exp_id=5282cf8f-365c-4250-a2c0-5ac28688c1b0-43&pdp_npi=4%40dis%21THB%217773.00%214741.53%21%21%211500.00%21915.00%21%402101fb1617198271132077205e6a1b%2112000039722253004%21sea%21TH%210%21AB&curPageLogUid=b4UbbkHIlSxQ&utparam-url=scene%3Asearch%7Cquery_from%3A&search_p4p_id=2024070102451334294150035340004908405_11,Oversea,0.0,YRX,,
